{
  "$schema": "../_schema/pack.schema.json",
  "id": "horizon_europe_ria_ia",
  "name": "Horizon Europe — Research and Innovation Action (RIA) / Innovation Action (IA)",
  "short_name": "HE RIA/IA",
  "version": "1.0.0",
  "spec_version": "1",
  "description": "Standard proposal structure and evaluation criteria for Horizon Europe Research and Innovation Actions (RIA) and Innovation Actions (IA), based on the Horizon Europe Programme Guide and the Standard Evaluation Form used by independent expert reviewers.",

  "metadata": {
    "funding_body": "European Commission (EC)",
    "programme": "Horizon Europe (2021–2027)",
    "action_types": ["RIA", "IA"],
    "funding_rate": {
      "RIA": "100% of eligible costs for all entity types",
      "IA": "70% of eligible costs for profit-making entities; 100% for non-profit entities"
    },
    "source_documents": [
      "Horizon Europe Programme Guide v3.0 (April 2023)",
      "HE Standard Application Form (RIA/IA), Part B template",
      "HE General Model Grant Agreement (MGA)",
      "HE Open Science requirements (Article 14 MGA)",
      "HE Ethics Review Procedures"
    ],
    "last_updated": "2024-09-01",
    "contributor": "GrantCraft Contributors",
    "notes": "Page limits and exact sub-section requirements vary by call topic and cluster. Always cross-check this pack against the specific Call for Proposals (CfP) text and the Work Programme annex before submission."
  },

  "page_limits": {
    "default_total": 45,
    "unit": "A4 pages",
    "font_requirements": "Times New Roman 11pt or Arial/Helvetica/Calibri 10pt",
    "line_spacing": "single",
    "margins_minimum_mm": 15,
    "call_specific_note": "Some calls deviate significantly: ERC Starting/Consolidator Grants use different forms; large Partnerships may allow 70 pages; fast-track/Pathfinder calls may restrict to 20–30 pages. Always read Section 5 of the specific topic text.",
    "per_section_guidance": {
      "excellence": "~15 pages (recommended)",
      "impact": "~15 pages (recommended)",
      "implementation": "~15 pages (recommended)"
    },
    "pages_NOT_counted": [
      "Cover page (Part A data)",
      "Table of contents",
      "List of references / bibliography",
      "CVs of key personnel (Annex)",
      "Letters of commitment (Annex)",
      "Activity reports of partners (Annex)"
    ]
  },

  "scoring_rules": {
    "threshold_per_criterion": 3.0,
    "overall_threshold": 10.0,
    "max_score_per_criterion": 5,
    "total_max_score": 15,
    "scoring_step": 0.5,
    "weights": {
      "excellence": 0.333,
      "impact": 0.333,
      "implementation": 0.334
    },
    "rejection_rule": "A proposal failing ANY single criterion threshold (score < 3.0) is rejected, regardless of total score.",
    "ranking_note": "When scores are equal, priority order is: (1) Impact score, (2) Excellence score, (3) Implementation score."
  },

  "evaluation_criteria": [
    {
      "id": "excellence",
      "title": "Excellence",
      "weight": 0.333,
      "threshold": 3.0,
      "max_score": 5,
      "description": "The scientific/technological quality, ambition, and credibility of the proposed approach. Reviewers assess whether the proposal articulates clear, ambitious objectives and demonstrates a rigorous, feasible methodology that goes substantially beyond the current state of the art.",
      "differentiated_by_action_type": {
        "RIA": "Greater emphasis on scientific novelty, fundamental research approach, and academic excellence.",
        "IA": "Greater emphasis on innovation readiness (higher TRL target), viability of the innovation pathway, and proximity to market or deployment."
      },
      "sub_criteria": [
        {
          "id": "objectives_ambition",
          "title": "Objectives and Ambition",
          "description": "Clarity, measurability, and ambition of the project objectives. Does the project push boundaries?"
        },
        {
          "id": "methodology",
          "title": "Soundness of Methodology",
          "description": "Appropriateness, credibility, and rigour of the methodology; treatment of risks and alternatives; interdisciplinary aspects."
        },
        {
          "id": "sota",
          "title": "Beyond the State of the Art",
          "description": "Quality of the SotA analysis; clarity of the gap being addressed; evidence that the proposal advances the field substantially."
        }
      ],
      "what_reviewers_look_for": [
        "Specific, measurable, achievable, relevant, time-bound (SMART) objectives",
        "Explicit ambition statement — why is this challenge significant at the European or global level?",
        "Clear positioning vs. current state of the art with identified knowledge/technology gaps",
        "Soundness and originality of the proposed methodology and research design",
        "Justification for why the chosen approach is optimal among alternatives",
        "Quantified success criteria and validation approach",
        "Identification of critical assumptions and how they will be tested",
        "Interdisciplinary, multi-actor, or co-design elements where relevant to the topic",
        "Preliminary/proof-of-concept results that demonstrate feasibility",
        "Current TRL and realistic target TRL at project end"
      ],
      "common_pitfalls": [
        "Objectives stated as activities ('We will develop X') rather than outcomes ('We will demonstrate X achieving Y performance')",
        "Methodology presented as a list of tasks without scientific justification",
        "SotA section that reads as a literature review without identifying gaps or positioning the proposal",
        "Ambition claims (e.g., 'breakthrough') unsupported by evidence or specifics",
        "No mention of TRL, or unrealistic TRL progression",
        "Alternative approaches not considered or dismissed without rationale",
        "Feasibility risks not acknowledged or addressed",
        "Preliminary results claimed without data or references"
      ]
    },
    {
      "id": "impact",
      "title": "Impact",
      "weight": 0.333,
      "threshold": 3.0,
      "max_score": 5,
      "description": "The extent to which project outputs will contribute to the expected outcomes stated in the call topic, and to wider scientific, economic, and societal impacts. Reviewers assess the credibility of the pathway to impact and the adequacy of open science, dissemination, and exploitation plans.",
      "differentiated_by_action_type": {
        "RIA": "Impacts can be longer-term; scientific and technological impacts are primary. Market potential is secondary.",
        "IA": "Closer-to-market impacts expected. Commercialisation or deployment pathways must be credible and near-term. TRL uplift to ≥6 is typically expected."
      },
      "sub_criteria": [
        {
          "id": "expected_outcomes",
          "title": "Expected Outcomes and Impacts",
          "description": "Alignment with call expected outcomes; scientific, economic, and societal impacts; beneficiaries."
        },
        {
          "id": "pathway_to_impact",
          "title": "Pathway to Impact",
          "description": "Strategy to maximise impact; exploitation plan; IP; market/policy uptake routes."
        },
        {
          "id": "dissemination_exploitation",
          "title": "Dissemination, Exploitation and Open Science",
          "description": "Plans for sharing results; open access; FAIR data; communication to target audiences."
        }
      ],
      "what_reviewers_look_for": [
        "Explicit mapping of project outcomes to the call topic's 'Expected Outcomes' bullet points",
        "Quantified impact indicators (e.g., cost reduction %, number of users, publications in journals with IF > X)",
        "Credible short-, medium-, and long-term impact timeline",
        "Identified target beneficiaries/end-users and how they will access/adopt results",
        "Concrete exploitation strategy: who exploits what, how, and when",
        "IP ownership and licensing plan (especially for multi-partner consortia)",
        "Market sizing and entry strategy (required for IA, good practice for RIA)",
        "Open access plan for publications (mandatory in HE)",
        "Data Management Plan commitment (DMP due Month 6)",
        "FAIR data principles application",
        "Engagement of non-academic stakeholders in impact creation",
        "Dissemination activities beyond academic publications (policy briefs, press, demos)"
      ],
      "common_pitfalls": [
        "Outcomes section that copies call text without explaining how the project achieves them",
        "Vague impact language: 'our results will benefit society' without specifics",
        "Dissemination plan limited to 'publish papers and attend conferences'",
        "No mention of open access or data management",
        "Exploitation plan missing or generic ('we will commercialise if results are good')",
        "IP strategy absent for projects with commercial potential",
        "No quantified impact indicators or KPIs",
        "Ignoring the mandatory HE open science requirements",
        "Stakeholders listed but no engagement plan described"
      ]
    },
    {
      "id": "implementation",
      "title": "Implementation",
      "weight": 0.334,
      "threshold": 3.0,
      "max_score": 5,
      "description": "The coherence and effectiveness of the work plan, the appropriateness of management structures, the quality and complementarity of the consortium, and the justification of the requested resources.",
      "differentiated_by_action_type": {
        "RIA": "Flexibility in methodology and work plan is acceptable given research uncertainty. Consortium may include more academic partners.",
        "IA": "Work plan should reflect a more deterministic, engineering approach. Industry partners and end-users should feature prominently."
      },
      "sub_criteria": [
        {